4886,"Monsters, Inc. (2001)",4.028992454900077
4896,"Harry Potter and the Sorcerer's Stone (a.k.a. Harry Potter and the Philosopher's Stone) (2001)",4.735088911671041
5816,"Harry Potter and the Chamber of Secrets (2002)",4.362028051627108
8368,"Harry Potter and the Prisoner of Azkaban (2004)",5.0
40815,"Harry Potter and the Goblet of Fire (2005)",4.68705296846846
54001,"Harry Potter and the Order of the Phoenix (2007)",4.118070703927065
69844,"Harry Potter and the Half-Blood Prince (2009)",4.324949742817325
81834,"Harry Potter and the Deathly Hallows: Part 1 (2010)",4.232441030751908
